{
  "name": "Batch 3x jesse",
  "description": "Deploy 3 jesse tokens",
  "chain": "base",
  "defaults": {
    "fee": 10,
    "mev": 8,
    "feeType": "static",
    "tokenAdmin": "0x2211d1D0020DAEA8039E46Cf1367962070d77DA9",
    "rewardRecipient": "0x3A1dc8C3C1A28853b8002AeBaF98F604c4c51795",
    "rewardToken": "Both",
    "image": "bafkreiaxvv4vlu65mkmbzpfjvtug25d3gfsveyhzasvpa7wdtfvcwhlq44",
    "description": "Token Deployed by Clanker SDK",
    "socials": {
      "farcaster": "99"
    },
    "interfaceName": "UMKM Terminal",
    "platformName": "Clanker"
  },
  "tokens": [
    {
      "name": "jesse",
      "symbol": "jesse",
      "image": "bafkreiaxvv4vlu65mkmbzpfjvtug25d3gfsveyhzasvpa7wdtfvcwhlq44",
      "description": "Token Deployed by Clanker SDK",
      "socials": {
        "farcaster": "99"
      },
      "tokenAdmin": "0x2211d1D0020DAEA8039E46Cf1367962070d77DA9",
      "rewardRecipients": [
        {
          "address": "0x3A1dc8C3C1A28853b8002AeBaF98F604c4c51795",
          "allocation": 100
        }
      ]
    },
    {
      "name": "jesse",
      "symbol": "jesse",
      "image": "bafkreiaxvv4vlu65mkmbzpfjvtug25d3gfsveyhzasvpa7wdtfvcwhlq44",
      "description": "Token Deployed by Clanker SDK",
      "socials": {
        "farcaster": "99"
      },
      "tokenAdmin": "0x2211d1D0020DAEA8039E46Cf1367962070d77DA9",
      "rewardRecipients": [
        {
          "address": "0x3A1dc8C3C1A28853b8002AeBaF98F604c4c51795",
          "allocation": 100
        }
      ]
    },
    {
      "name": "jesse",
      "symbol": "jesse",
      "image": "bafkreiaxvv4vlu65mkmbzpfjvtug25d3gfsveyhzasvpa7wdtfvcwhlq44",
      "description": "Token Deployed by Clanker SDK",
      "socials": {
        "farcaster": "99"
      },
      "tokenAdmin": "0x2211d1D0020DAEA8039E46Cf1367962070d77DA9",
      "rewardRecipients": [
        {
          "address": "0x3A1dc8C3C1A28853b8002AeBaF98F604c4c51795",
          "allocation": 100
        }
      ]
    }
  ]
}
