{
  "name": "Batch 9x JESSE",
  "description": "Deploy 9 Jesse Pollak tokens",
  "chain": "base",
  "defaults": {
    "fee": 10,
    "mev": 8,
    "feeType": "static",
    "tokenAdmin": "",
    "rewardRecipient": "0x3A1dc8C3C1A28853b8002AeBaF98F604c4c51795",
    "rewardToken": "Both",
    "image": "ipfs://bafkreiaxvv4vlu65mkmbzpfjvtug25d3gfsveyhzasvpa7wdtfvcwhlq44",
    "description": "base builder #001 | DM jessexbt to get started building",
    "socials": {
      "farcaster": "99"
    },
    "interfaceName": "UMKM Terminal",
    "platformName": "Clanker"
  },
  "tokens": [
    {
      "name": "Jesse Pollak",
      "symbol": "JESSE",
      "image": "ipfs://bafkreiaxvv4vlu65mkmbzpfjvtug25d3gfsveyhzasvpa7wdtfvcwhlq44",
      "description": "base builder #001 | DM jessexbt to get started building",
      "socials": {
        "farcaster": "99"
      },
      "tokenAdmin": "0x4ce34AF3378a00C640125e4dBF4c9e64dff4c93b",
      "rewardRecipients": []
    },
    {
      "name": "Jesse Pollak",
      "symbol": "JESSE",
      "image": "ipfs://bafkreiaxvv4vlu65mkmbzpfjvtug25d3gfsveyhzasvpa7wdtfvcwhlq44",
      "description": "base builder #001 | DM jessexbt to get started building",
      "socials": {
        "farcaster": "99"
      },
      "tokenAdmin": "0xE73F9c181B571Cac2bf3173634d04a9921b7fFcf",
      "rewardRecipients": []
    },
    {
      "name": "Jesse Pollak",
      "symbol": "JESSE",
      "image": "ipfs://bafkreiaxvv4vlu65mkmbzpfjvtug25d3gfsveyhzasvpa7wdtfvcwhlq44",
      "description": "base builder #001 | DM jessexbt to get started building",
      "socials": {
        "farcaster": "99"
      },
      "tokenAdmin": "0x6e0d9c6dd8a08509bB625CAa35dc61a991406F62",
      "rewardRecipients": []
    },
    {
      "name": "Jesse Pollak",
      "symbol": "JESSE",
      "image": "ipfs://bafkreiaxvv4vlu65mkmbzpfjvtug25d3gfsveyhzasvpa7wdtfvcwhlq44",
      "description": "base builder #001 | DM jessexbt to get started building",
      "socials": {
        "farcaster": "99"
      },
      "tokenAdmin": "0x849151d7D0bF1F34b70d5caD5149D28CC2308bf1",
      "rewardRecipients": []
    },
    {
      "name": "Jesse Pollak",
      "symbol": "JESSE",
      "image": "ipfs://bafkreiaxvv4vlu65mkmbzpfjvtug25d3gfsveyhzasvpa7wdtfvcwhlq44",
      "description": "base builder #001 | DM jessexbt to get started building",
      "socials": {
        "farcaster": "99"
      },
      "tokenAdmin": "0x2211d1D0020DAEA8039E46Cf1367962070d77DA9",
      "rewardRecipients": []
    },
    {
      "name": "Jesse Pollak",
      "symbol": "JESSE",
      "image": "ipfs://bafkreiaxvv4vlu65mkmbzpfjvtug25d3gfsveyhzasvpa7wdtfvcwhlq44",
      "description": "base builder #001 | DM jessexbt to get started building",
      "socials": {
        "farcaster": "99"
      },
      "tokenAdmin": "0x8E86e5331D3A020909c9e42eA9051675555F5e49",
      "rewardRecipients": []
    },
    {
      "name": "Jesse Pollak",
      "symbol": "JESSE",
      "image": "ipfs://bafkreiaxvv4vlu65mkmbzpfjvtug25d3gfsveyhzasvpa7wdtfvcwhlq44",
      "description": "base builder #001 | DM jessexbt to get started building",
      "socials": {
        "farcaster": "99"
      },
      "tokenAdmin": "0x6ADea326FaeA1b688Af33Df59E18F7a819bCAA4F",
      "rewardRecipients": []
    },
    {
      "name": "Jesse Pollak",
      "symbol": "JESSE",
      "image": "ipfs://bafkreiaxvv4vlu65mkmbzpfjvtug25d3gfsveyhzasvpa7wdtfvcwhlq44",
      "description": "base builder #001 | DM jessexbt to get started building",
      "socials": {
        "farcaster": "99"
      },
      "tokenAdmin": "0x85c0BA9e1456Bc755a6ce69E1a85ccaA1FAa9E41",
      "rewardRecipients": []
    },
    {
      "name": "Jesse Pollak",
      "symbol": "JESSE",
      "image": "ipfs://bafkreiaxvv4vlu65mkmbzpfjvtug25d3gfsveyhzasvpa7wdtfvcwhlq44",
      "description": "base builder #001 | DM jessexbt to get started building",
      "socials": {
        "farcaster": "99"
      },
      "tokenAdmin": "0x46960D116427A03FF05C6A0Defe35e9DC29C0A69",
      "rewardRecipients": []
    }
  ]
}